Identifier,Submitter-id,Severity-desc,Status-desc,Headline,Summary (Max 2K Chars),Project,Product,Component,Cust Priority,DE-priority-desc,DE-manager,Submitted-on
CSCvb75033,xvincent,moderate,A-Assigned,CSO sub-vpn with custom services-ipv4-subnet  causes abort during AD deletion,"On CSO with function pack 0.2.2_161014, after configuring a sub-vpn with non-default services-ipv4-subnet, access-desgns deletions abort with error;  Aborted: 'resource-pools ip-address-pool sub-vpn-pool-VPN1-sub1 allocation VPN1-n1-sub1-fw username' is not configured  See logs + triage email attached.",CSC.embu,ngena,cso,NA,medium,vleijon,10/17/2016 05:16:55
CSCvb74805,xvincent,moderate,A-Assigned,"NSO CPE LAN ospf authentication, message-digest-key is missing","On NSO function pack ngena 0.2.2_161014, when configuring an access-design with CPE LAN routing ospf,  'ip ospf message-digest-key &lt;key-id&gt; md5 &lt;key&gt;' is missing. See triage email attached.",CSC.embu,ngena,nso,NA,high,vleijon,10/17/2016 03:15:35
CSCvb74626,xvincent,moderate,R-Resolved,NSO CPE LAN routing; locator-set INTERNET01 definition is missing,"On NSO function pack ngena 0.2.2_161014, when configuring an access-design with CPE LAN routing (ospf in this case), the CPE router lisp   'locator set INTERNET01'  configuration is missing, should be added.   See logs + triage email attached.",CSC.embu,ngena,nso,NA,high,vleijon,10/17/2016 01:33:38
CSCvb69037,xvincent,moderate,A-Assigned,NSO NED ios:ip name-server issue when importing 2 ip addresses,"On NSO NED (NSO 4.3.0 with ngena function pack 0.2.2_161005, but it looks like a generic NED issue);  When adding a second ios:ip name-server ip from NSO, the correct configuration is applied on the device, but the IOS-XE device groups the 2 name-server ip addresses under 1 single line;     ip name-server 8.8.8.8 9.9.9.9  NSO is then unable to parse this IOS-XE configuration line with 2 ip addresses, and fails to import. Device sync-from on NSO results in the ios:ip name-server section to be emptied.  See logs attached.",CSC.embu,ngena,nso,NA,medium,vleijon,10/12/2016 00:46:07
CSCvb68974,xvincent,moderate,R-Resolved,"Firewall rules; ipv6 prefix lengths are dropped on NSO, causing ACL fail on ASAv","On NSO Function Pack 0.2.2_161005 with 'Custom firewall rules' feature; when configuring an ipv6 access-list on CSO, the ipv6 prefix lengths are being dropped on NSO/NED before the ACL is applied to ASAv, this causes the ACL configuration to fail.  See triage email attached. Full logs on http://10.53.233.235/NGENA/TestLogs/11oct_fw_rule_ipv6_fail.txt",CSC.embu,ngena,nso,NA,medium,vleijon,10/12/2016 00:21:18
CSCvb67646,xvincent,moderate,R-Resolved,access-design creation fails on sub-vpn without internet breakout,"On CSO FP 0.2.2_161005 with CSCvb34888 integrated; When attempting to create an access-design on a sub-vpn without internet-breakout, it fails with;  Trace : [java.lang.NullPointerException]         com.ngena.cfs.accessDesignCFS.hasInternetBreakout(accessDesignCFS.java:839)  Full logs on http://10.53.233.235/NGENA/TestLogs/11oct_sub_internet-breakout-False_AD_creation_fails.txt",CSC.embu,ngena,cso,NA,medium,vleijon,10/11/2016 05:40:03
CSCvb64355,xvincent,moderate,R-Resolved,"AD deletion; NSO deletes subnet+net before VNF, causing ESC confd transaction abort","On NSO 0.2.2_161009 + ESC 2.2.8, during service chain deletion, NSO is attempting to delete the internel pxtr-asav neutron subnet+net before deleting the attached VNFs pxtr+asav.  On previous FP + ESC 2.1.8, this was causing Warnings, but no abort. This is now causing Confd Transaction Abort on ESC and prevents AD deletion. WA for AS deletion; remove components manually on NSO.  Full logs on http://10.53.233.235/NGENA/TestLogs/6oct_del_ad_fail_ESC_work_order.txt  INFO  Deleting subnet [sn] before deleting network [ivpn20161006T164116-sub1-pxtr-fw] INFO  =====  DELETE NETWORK REQUEST ACCEPTED  ===== WARN  CDB subscription iteration is cancelled. WARN  Aborting ConfD transaction due to: Work order validation failed: Work item validation failed for Delete: Config [SubnetConfig:SystemAdminTenantIdivpn20161006T164116-sub1-pxtr-fwsn, configStatus: ACTIVE] is still referred to by config: [ServiceConfig:SystemAdminTenantIdcsr-pxtr-ivpn20161006T164116-sub1, configStatus: ACTIVE]",CSC.embu,ngena,nso,NA,medium,vleijon,10/07/2016 02:11:27
CSCvb63413,xvincent,enhancement,N-New,"Firewall custom rules, rename keywords  ip to host, netmask to prefix",Currenty on CSO FP 0.2.2_161005 firewall custom rule syntax is; cloud@cso% set sub-vpns X sub-vpn Y outbound-firewall-rules rule 1 protocol tcp source ? Possible completions:   any  ip  netmask  port  port-any  port-range  'ip'      accepts an ip address a.b.c.d 'netmask' accepts a prefix a.b.c.d/e  which is confusing. rename; ip to host netmask to prefix,CSC.embu,ngena,cso,NA,medium,vleijon,10/06/2016 11:37:29
CSCvb63334,xvincent,moderate,N-New,NSO should re-apply Day1 config after deleted VNF is respawned by ESC.,"On NSO FP 0.2.2_161005. Negative test; after doing a 'nova delete' on a VNF, ESC detects VM down, attempts recovery, nova boots a new VNF with day0 config, notifies NSO about 'VM_RECOVERY_COMPLETE' Success. NSO should then re-apply day1 config. This is currently not occurring, VNF is left with day0 config.  See full logs attached  ",CSC.embu,ngena,nso,NA,medium,vleijon,10/06/2016 10:44:25
CSCvb59277,xvincent,severe,V-Verified,"vpn-infra VNFs stuck in 'unknown', never reaching 'done' state","On NSO with latest FP 0.2.0_160930, when creating a vpn on CSO, the infra VNFs KeyServer and MapServer are stuck in 'unknown', never reaching 'done' state, preventing sub-vpns deployments.  [Johannes]: The issue with vpn state appeared when we started using plans in nso. The nso plans are not visible from cso which is why some values show up as &quot;unknown&quot; now. This is a bug somewhere in the nso ecosystem  Triage email + full logs attached.",CSC.embu,ngena,nso,NA,high,vleijon,10/04/2016 08:22:44
CSCvb55682,xvincent,moderate,R-Resolved,"CPE LAN secondary ipv4 address is missing 'secondary' keyword on NSO NED, replaces primary","On CSO/NSO 0.2.0_160909, when configuring a secondary ipv4 address on CPE LAN Vlan SVI, ned-ios-cpe is missing the 'secondary' keyword.  As a result, the existing primary is overwirrten, instead of creating a new secondary.  See logs attached.",CSC.embu,ngena,nso,NA,medium,vleijon,09/30/2016 08:01:26
CSCvb46151,xvincent,moderate,V-Verified,"CPE LAN access switch mode, L2 vlans should be created on CPE","On CSO/NSO service pack 0.2.0_160909, when creating an access-design with L2 access native or trunked mode, the vlans are currently missing.  All the layer2 vlans should be created on CPE, along with the Vlan SVIs. (Layer3);   devices {      device cpe-FLM2029W01T {          config {              ios:vlan { +                vlan-list 1066 {  &lt;&mdash;-   we are missing this on NSO +                }",CSC.embu,ngena,nso,NA,medium,vleijon,09/23/2016 08:35:06
CSCvb37857,xvincent,moderate,R-Resolved,Umbrella DDTS for NGENA CPE LAN trunked+native access,"Placeholder for ngena CPE LAN access in trunk mode issues:  Issue #1; On CSO/NSO service Pack ngena 0.2.0_160909, when configuring trunked + native vlans simultaneously on CPE LAN access port, the following IOS config line is missing on CPE LAN GiE interface:   cpe(config)#int gi0/1/0   cpe(config-if)#switchport trunk native vlan &lt;native_vlan&gt; Logs attached.",CSC.embu,ngena,nso,NA,medium,vleijon,09/19/2016 00:31:01
CSCvb36570,xvincent,moderate,R-Resolved,LISP EID mapping should be removed when removing L3-interface,"On CSO/NSO with servicePack 0.2.0_160909, when deleting a trunked vlan + associated L3-interface on CPE access-design, the corresponding Router lisp &gt; eid db-mapping should be removed.  Please find repto logs + NED-cpe.trace attached",CSC.embu,ngena,nso,NA,medium,vleijon,09/16/2016 11:33:39
CSCvb34888,xvincent,moderate,R-Resolved,subvpn with internet-breakout=false should not spin up service chain,"On CSO servicePack 0.2.0_160909, when creating a subvpn with option 'with-internet-breakout' = false, CSO/NSO is spinning up PxTR+ASAv. No service chain should be created in this case.  See email attached.",CSC.embu,ngena,cso,NA,medium,vleijon,09/15/2016 11:55:27
